,title,content
0,"선생님, 비밀인데… 급한 아이가 1주일 기다려야 하는 한사람"," 한겨레  학교는 단지 학습하는 공간을 넘어 아이들이 자라는 곳이다. 아이들을 먹이고, 학교에 남은 아이들을 돌보고, 여러 예술·체육 활동을 즐길 수 있게 하고 혹시 마음이 다치지는 않았는지도 살펴야 한다. 모두 아이들을 키우는 일이지만 교사가 이 모든 것을 담당하기엔 역부족이다. 학교는 이들을 강사로, 돌봄전담사로, 상담사로, 영양사로, 조리원으로 다루고 세상은 이들을 ‘아줌마’로 부르기도 한다. 학생과의 관계 속에서 얻는 보람과 학교라는 시스템 속에서 받는 차별 사이에 이들의 삶이 놓여 있다. <학교에 일하러 가는 사람들>은 학교 비정규직 노동의 실제와 의미를 생생하게 보여주려 현장 취재 내용에 문학적 요소를 가미했다. <한겨레>는 ‘전국교육공무직본부’의 기획으로 이철 작가가 본 학교 현장을 매주 한 차례씩 모두 10회에 걸쳐 싣는다.  아이는 학교에 다녀야 할 이유를 찾지 못했다. 가고 싶던 특성화 고등학교에 떨어지고 떠밀리듯 일반계 고등학교에 들어왔다. 한 학년을 아무 일 없이 보냈다. 결석한 적도, 지각한 적도 없었지만, 수업을 따라가지 못했다. 1년을 조용히 제 자리만 지키며 보냈다. 가만히 앉아 있기도 했고, 멍하니 창밖을 내다보기도 했으며 때로는 엎드려서 자기도 했다. 2학년이 되자 아이는 자퇴를 결심했다. 학교 밖으로 나가 기술을 배우는 게 좋겠다는 생각이었다.  “불안했구나. 많이 힘들었겠다.” 가만히 아이의 말을 듣던 김하영씨(가명)가 한마디를 건넸다. 아이가 느꼈을 감정을 이해한다는 뜻이었다. 아이는 주변에 마음을 터놓을 친구가 없었다. 고등학교에 진학하면서 가깝게 지내던 친구들과 떨어졌다. 이후 새로운 친구를 만들지 못했다. 학교에서는 작은 흥미를 찾을 수도 없었다. 학교 다니는 보람이 없으니 다른 아이에게 관심이 생기질 않았다. 김하영씨는 아이가 말하는 동안 아이의 표정과 몸짓, 그리고 말에서 묻어나는 분위기까지 수첩에 적었다. 김하영씨는 전문상담사 7년 차다.  비정규직 전문‘상담사’ 3800여명정규직 전문‘상담교사’ 1800여명정신건강·또래갈등·진로문제까지상담교사는 한 학교에서 아이 만나지만상담사는 두 학교 오가며 ‘보따리 상담’ 김하영씨는 아이의 불안과 외로움을 이해했다. 많은 아이가 겪는 문제였다. 아이에게 생각할 시간이 주어진 것이 참 다행이었다. 아이는 학업중단 숙려제를 통해 학교를 잠시 쉬고, 자기 문제를 고민하는 기간을 갖고 있었다. 졸업 후 진로로 불안해하는 아이에게 위탁교육이라는 게 있다고 알려줬다. 3학년이 되면 자신이 원하는 분야의 기술교육을 받을 수 있다는 조언이었다. 가깝게 지냈던 친구들에 관해서도 물었다. 그들과의 관계가 특별할 수 있었던 이유와 쌓은 추억을 떠올려 보게 했다.  Wee클래스 전문상담사가 진행하는 집단 상담과 힐링 프로그램의 한 장면이다.Wee클래스 전문상담사가 자살위기 및 정서행동특성검사 관심군 학생들을 선별해 놓은 자료들이다.  학업중단 숙려제는 학교를 자퇴하려는 학생에게 생각할 시간을 주는 제도다. 최소 2주 이상의 시간을 준다. 이 기간에 학교를 나오지 않아도 되지만, 대신 한 주에 두 차례 상담을 받아야 한다. 전문상담사가 심리 검사를 진행하고 상담을 진행한다. 가정불화, 또래 갈등, 정신 건강, 진로나 진학, 학습 무기력 등 문제 유형은 다양하다. 학교에 적응하지 못하면 자퇴로 이어지는 경우가 많다. 상담사는 학생에게 예체능 활동이나 진로체험 등 심리적 부담과 불안을 덜어줄 프로그램을 마련해주기도 한다.  학업중단 숙려제는 2011년 경기도교육청에서 처음 시행했고, 다음 해 전국으로 확대됐다. 매년 초·중·고 학생 6만여 명이 학업을 그만둔다. 고등학교에서만 3만4000여 명의 학생이 학교를 떠난다. 학생이 학교를 떠나면 학생에게 위기가 닥쳐도 학교는 도울 방법이 없다. 일주일에 한 번이었던 상담 횟수는 얼마 전부터 두 번으로 늘었다. 인천 초등학생 살해 사건이 계기였다. 주범 김 양은 학교를 자퇴한 학교 밖 청소년이었다. 학교가 학생을 돌보는 건 사회를 돌보는 일로 연결된다.  아이가 울음을 터뜨렸어요친구들한테 피해만 주는 걸얼마나 두려워하는지…"
1,동성애자에 “치료받으라”…어이없는 상담가,"지난해 레즈비언인 김미성(가명·17)씨가 ‘헬프콜 청소년전화 1388’과 나눈 카카오톡 상담 내용. 사진 청소년성소수자위기지원센터 띵동 제공 레즈비언인 김미성(가명·17)씨는 지난해 ‘헬프콜 청소년전화 1388’에 카카오톡 상담을 요청했다. 성소수자라는 이유로 왕따를 당해 학교를 자퇴한 뒤 우울증으로 정신과 진료를 받던 차였다. 상담원은 “상담을 더 받고 동성애자로 살지 말지 결정하는 게 좋겠다”, “아직 청소년이니까 (동성애) 치료를 받는 게 좋을 것 같다”는 카톡 메시지를 보내왔다. 김씨는 ‘아무도 날 이해해주지 않는다’는 충격에 하루 종일 눈물을 흘렸다.  심리 상담을 받으러 갔다가 상담가로부터 성소수자 혐오 발언을 듣는 등 인권 침해를 경험한 성소수자의 비율이 40%에 가까운 것으로 드러났다. 20여개 인권단체로 구성된 전환치료근절운동네트워크는 성소수자 1072명을 대상으로 지난해 12월 실시한 ‘성소수자 상담경험 실태조사’ 결과를 25일 연세대에서 열리는 ‘성소수자 인권포럼’에서 발표한다.   응답자 중 상담경험이 있는 성소수자는 73.8%(791명)로, 이들은 위(wee)클래스 등 중·고등학교 상담소(41.5%)나 정신건강의학과 등 의료기관(32.7%), 대학 부설 상담센터(24.3%) 등에서 정신 건강, 대인 관계, 성 정체성 문제 등을 주제로 심리 상담을 받았다고 답했다. 이들은 상담가가 자신의 성적 지향·성별 정체성을 알게 됐을 때 ‘이해·공감하지 못했다’(38.3%)고 말했다.    성소수자를 있는 그대로 받아들이지 않는 상담가의 태도는 ‘비전문적인 상담’으로 이어졌다. ‘동성을 사랑하는 마음은 치료할 수 있다’(20.3%), ‘여성이 여성을 사랑하는 것은 어렸을 때의 나쁜 경험 때문이다’(18.6%), ‘동성애는 도덕적이지 않다’(13.4%) 등이다. “요즘 성소수자 되는 게 유행이냐”, “섹스테라피를 받아보면 어떠냐” 등의 발언을 들었다는 답변도 있었다. 이런 발언은 심리상담가(22.3%), 종교인(18.6%), 의사(15.1%), 상담교사(13.1%)에 의해 행해졌다.  실태조사 연구에 참여한 별의별상담연구소 상담가 미묘(활동명)는 “심리상담가를 교육하고 전문성을 보증하는 대부분의 학회가 성소수자 상담 교육을 실시하지 않고 있다. 그러다 보니 상담가 개인의 역량에 의존해 비전문적인 상담이 벌어진다”며 “심리적으로 고립된 사람들이 찾는 상담에서조차 성소수자들이 혐오·차별을 경험하면 우울감이 더 극심해질 수 있다”고 말했다. 고한솔 기자 sol@hani.co.kr"
2,“최대 2배 차이…학교 영양교사와 영양사 임금격차 줄여야”,"학교 급식실 모습. 한겨레 자료 사진  영양교사와 영양사, 전문상담교사와 전문상담사 간의 임금 격차를 줄여야 한다는 국가인권위원회(인권위)의 정책 개선 권고가 나왔다.  인권위는 “(영상사와 전문상담사 등) 교육공무직과 영양 교사, 전문상담교사의 임금 격차를 줄이는 방안을 마련하고, 교육청별 공통적인 임금 기준을 마련해야 한다는 입장을 교육부 장관 및 17개 시·도교육감에게 표명했다”고 2일 밝혔다.   학교에서 급식업무를 수행하는 영양사와 학생 상담업무를 하는 전문상담사들은 2017∼2018년 “영양사와 전문상담사의 임금을 영양 교사와 전문상담교사의 임금에 비해 현저히 낮게 지급하는 것은 차별”이라며 인권위에 진정을 제기했다. 이에 대해 교육부 장관은 “영양사와 학교 전문상담사는 필요한 업무를 위해 근로계약을 맺은 근로자지만, 전문상담교사는 교원 자격을 갖고 학생 상담과 교육활동 등을 수행하기 위해 임용시험을 거친 교육 공무원”이라며 “전문상담사와 전문상담교사는 자격요건과 채용경로, 그에 따른 역할 차이와 근거 법령이 다르다는 점에서 차별 행위가 있다고 볼 수 없다”고 밝혔다.  하지만 인권위 조사 결과, 교육 공무원인 교사는 교육공무직인 영양사·전문상담사에 견줘 최대 2배에 이르는 임금을 받고 있었다. 영양사의 급여 총액은 영양 교사의 약 53.8~78.7% 수준에 그쳤다. 학생을 대상으로 상담업무를 하는 위(wee)클래스 전문상담사도 전문상담교사 임금의 약 59~85% 수준이었다. 또한 전문상담사의 경우 기본급에 대한 공통된 기준이 없어 교육청별로 기본급을 다르게 주고 있었다.  인권위는 이에 △영양 교사와 영양사, 전문상담교사와 위클래스 전문상담사의 업무 분석을 통해 각 비교집단이 동일·유사한 업무에 종사하지 않도록 개선방안 마련 △비교집단 간에 현저한 임금 격차를 줄여가는 방안 마련 △교육청별 위클래스 전문상담사 간의 상당한 임금 격차가 발생하지 않도록 전문상담사의 기본급 및 수당에 대한 일반적인 기준 마련 등이 필요하다고 판단했다. 다만 인권위는 “교사와 교육공무직원은 비교 대상이 되기 어려워 진정 사건은 각하하되, 인권위법 제25조에 따라 정책적 검토가 필요한 사안으로 보고 정책 개선을 권고했다”고 밝혔다.  권지담 기자 gonji@hani.co.kr "
3,"청소년 고민과 갈등, 전문적으로 상담해줘"," 학교폭력 문제와 집단따돌림 등으로 청소년들의 정신건강을 걱정하는 목소리가 높다. 피해학생들이 경험하는 불안이나 우울, 자살충동뿐 아니라, 가해학생들의 낮은 자존감과 공격적인 성향 역시 그대로 방치해선 안 되는 문제다. 이에 따라 청소년들이 안고 있는 각종 고민과 문제들을 전문적으로 상담하는 전문상담교사의 구실이 더욱 중요해지고 있다.  전문상담교사는 주로 교육지원청이나 학교의 상담실에서 근무한다. 또는 교육지원청에서 운영하는 위센터(Wee센터) 및 위클래스(Wee클래스·학교 단위의 학생공감상담실)에서도 다양한 상담과정을 진행한다. 경기도 군포의왕 교육지원청에서 전문상담교사로 근무하는 김성관(사진) 교사는 “학생들을 대상으로 개인상담이나 집단상담을 실시하고, 교사와 학부모를 대상으로 한 교육도 한다”며 “전문상담교사는 교육공무원 신분이기 때문에 근무시간이나 보수 역시 일반교사와 동일하다”고 설명했다.  김 교사는 “이 일은 심리적으로 힘들어하는 학생들에게 도움을 주는 일”이라며 “동료교사나 학부모에게도 청소년 문제에 대해 전문적으로 조언한다는 점에서 보람이 크다”고 했다. 이 외에도 전문상담교사는 청소년지원센터 같은 학교 밖 유관기관들과 협력하며 지역사회에 봉사할 수 있는 기회를 갖는다. 한편, 업무의 힘든 점에 대해서는 “주로 학교 상담실에 근무하기 때문에 동료교사와의 친밀감이 부족하고, 교육지원청 소속 전문상담교사들은 여러 학교를 순회해야 돼서 소속감 문제가 발생하기도 한다”고 말했다.    전문상담교사로 일하기 위해서는 전문상담교사 1급이나 2급 자격증을 취득하고 임용고사에 합격해야 한다. 자격증은 대학의 심리학과, 청소년학과, 상담학과 등을 전공하고 교직과정을 이수하면 취득할 수 있다. 만약 대학에서 교직이수를 못 했을 경우, 교육대학원에서 상담심리교육을 전공하면 교직이수와 마찬가지로 전문상담교사 2급 자격증을 취득할 수 있다. 상담에 대한 지식과 기술을 습득한 뒤에는 실습을 통해 상담 경험을 쌓는 것이 중요하다. 따라서 유능한 전문가의 지도와 조언을 받으며 장기적이고 다양한 상담을 훈련받아야 한다. 김 교사는 “상담활동은 뿌듯한 일이기도 하지만 고달픈 일이기도 하다”며 “상담 긴장을 해소하기 위해 유머감각을 키우는 것도 좋은 방법”이라고 조언했다.  한국고용정보원 직업연구센터 전임연구원관련전공  심리학과, 청소년 및 상담 관련 전공 등관련자격  전문상담교사 1급, 2급업무수행능력  듣고 이해하기, 문제해결, 가르치기, 선택적 집중력, 행동조정지식  상담, 심리, 사회와 인류, 철학과 신학, 국어성격  리더십, 정직성, 타인에 대한 배려, 자기통제, 인내흥미  사회형(Social), 탐구형(Investigative) "
4,CCTV도 아이를 지켜주지 못했다," “학교폭력은 지금처럼 하면 백퍼센트 못 잡아내요.… CCTV(폐회로텔레비전)가 안 달려 있거나 사각지대가 있습니다.…” 경북 경산에서 고등학교에 갓 진학한 고교생이 2년 동안 동급생들한테서 폭행당하고 돈을 빼앗기는 괴롭힘을 당했다는 유서를 남긴 채 11일 아파트에서 뛰어내려 목숨을 끊었다. 2011년 12월 대구에서 학교폭력에 시달린 중학생이 목숨을 끊은 뒤 정부가 대대적인 ‘학교폭력 종합대책’을 내놓았으나, 일선 교육 현장에서는 거의 효과를 내지 못하고 있음을 드러냈다. 이날 저녁 7시40분께 경산시 아파트 23층 계단 창문에서 이 아파트에 사는 최아무개(15·고교 1학년)군이 몸을 던져 숨졌다. 최군 가방에 들어 있던 공책에는 A4용지 1장 조금 넘는 분량의 유서가 발견됐다. 최군은 유서에 ‘내가 당한 것은 물리적 폭력, 조금이지만 금품갈취, 언어폭력 등이었다’고 썼다. 또 ‘2011년부터 현재까지 괴롭혀왔던 애들’이라며 자신과 같은 경산의 중학교에 다녔던 동급생 5명의 이름을 밝혔다. 이 가운데 2명은 최군과 같은 고교에 진학했다. 최군은 지난주 학교 기숙사에서 지낸 뒤 귀가했다가 이날 아침 6시20분께 등교했으나, 학교 앞에서 발길을 돌렸다. 고등학교도, 최군이 다녔던 중학교도 최군이 학교폭력에 시달린 점을 전혀 파악하지 못했다. 고교 담임 교사는 “입학한 지 일주일밖에 안 돼 잘 모른다”고 말했다. ㅈ중학교 교감은 “최군은 문제를 일으키지도 않았고 착했다. 괴롭혔다는 다른 학생들도 학교폭력으로 처벌받은 일은 없었다”고 말했다.학교폭력 정부대책 ‘무기력’…현장에선 비명 높았다2년간 동창들에게 시달린 최군“CCTV 없는 곳에서 폭행 당해”중3 정서행동검사 ‘관심군’ 분류상급학교 진학때 자료 안넘어가상담교사·프로그램 확충 ‘대안’정부, 1년만에 예산 대폭 줄여 최군은 지난해 중학교 전교생을 상대로 한 ‘정서행동특성검사’에서 관심군으로 분류됐다. 그러나 2차 정밀검사에서 정상으로 나오자, 학교 쪽은 지나쳤다. 이런 최군의 정서행동특성검사 결과는 최군이 진학한 고교에는 전달되지 않았다. 경북도교육청 학교폭력대책팀은 “자료를 상급 학교에 넘겨주라는 규정은 없고, 학생 개인적인 문제를 넘겨주는 게 곤란하지 않겠느냐”는 반응을 보였다. 지난해 학교폭력 대책 발표 이후 ㅈ중학교도 학교 안 복도, 운동장 등에 폐회로텔레비전 카메라를 19대 달았다. 하지만 최군이 주로 폭행당했다고 한 화장실이나 교실 등에는 없었다. 정부는 2005년 5개년 계획을 세워 폐회로텔레비전을 설치하기 시작해 2010년 2차 5개년 계획을 내놨다. 지난해 10월 교육과학술부는 전국 초·중·고 1만1360곳의 97.6%에 설치했다고 국회에 보고했다. 학교당 초등학교 8개, 중학교 9개, 고등학교 13개였다. 그러나 감사원이 지난해 11월 서울 등 학교 1707곳의 폐회로텔레비전 1만7471대를 점검한 결과, 96.8%는 사람 신원이나 차량번호판을 식별하기는 곤란한 50만화소 미만이었다. 그래도 학교폭력에 학생들의 희생이 이어지자, 정부는 지난해 2월 ‘학교생활기록부(학생부)에 가해 사실을 기재할 것’을 의무화하는 등 가해 학생 처벌에 초점을 맞춘 종합대책을 내놨다. 처벌 강화로는 학교폭력 예방에 한계가 있다는 지적이 잇따랐지만 정부는 밀어붙였고, ‘낙인 효과’ 등을 우려한 경기·전북도교육청 등에는 학생부 기재를 압박했다. ‘상담 인력·프로그램 강화로 예상·치유를 강화해야 한다’는 교육 현장의 지적에 따라, 교과부는 전문상담교사를 2013년엔 1000명 늘리고 학생상담교실인 ‘위(Wee) 클래스’를 3800곳에서 1000곳 더 확충하겠다는 대책도 함께 내놨다. 이후 학교마다 비정규직 전문상담사를 채용해 ‘위클래스’를 만들고, 학교 안팎에 폐회로카메라를 설치하는 등 부산을 떨었다. 경북도교육청은 교사들에게 상담연수를 했고, 모든 학생들을 상대로 정서행동특성검사도 했다. 다른 시·도교육청들도 크게 다르지 않았다. 그러나 정부는 한해 만에 상담 예산을 대폭 줄였다. 전문상담사 4000여명을 모두 계약 해지(해고)하고, 예산을 삭감해 올해는 960여명 줄여 새로 고용했다. 대구에선 148명으로 지난해보다 44명 줄었고, 경북에선 62명 줄어 194명만 새로 고용됐다. 김진우 좋은교사운동 공동대표는 “징계 사실을 학생부에 기재하는 등 정부의 엄벌주의적 대책은 초기에만 약효가 있었을 뿐이고 효과가 떨어지고 있다”고 말했다. 김자원 전국교직원노동조합 경북지부 정책실장은 “설문조사나 정서행동특성검사 등은 신뢰도·타당성 등이 떨어진다. 이런 조사로 세우는 대책이 효과를 낼 수 없음은 자명하다”고 지적했다. 경산/구대선 김일우 기자, 김지훈 기자 sunnyk@hani.co.kr "
